{
    "Contacto": {
        "Nombre": "Angelo Alfonso Astorga ",
        "Correo": "astorga.rozas@gmail.com",
        "Celular": "0992146683",
        "Linkedin": null
    },
    "Nombre archivo": "1567553800205-CV_Angelo_Astorga_Rozas_agosto_2019",
    "Licencias-Certificaciones": [
        "LICENCIA DE CONDUCIR",
        "CLASE B"
    ],
    "Palabras Claves": [
        "Gestión",
        "Análisis",
        "Aprender",
        "Liderar",
        "Voluntariado"
    ],
    "Educacion": {
        "Universidades:": [
            "Universidad de Antofagasta"
        ],
        "Grado_mas_alto": [
            "Doctor"
        ]
    },
    "Lenguajes": [
        "Inglés"
    ],
    "Experiencia": "antecedentes laborales\ndiciembre de 2018 a la fecha\ningeniero coordinador en empresa hatch, proyecto sexto muro de peralte del tranque\nlaguna seca en minera escondida. realizando funciones de coordinación y logística interna,\napoyo en el proceso de control documental y gestión de informes técnicos. apoyo en la\nsolución de problemáticas para el cliente en especialidades de geotecnia, hidráulica y\ncalidad.\nnoviembre 2017 a noviembre de 2018\nsupervisor y frecuentemente jefe de turno en todo acero montaje industrial, faena\ncordillera collahuasi. a cargo de liderar un turno de 30 trabajadores, logrando terminar\nactividades en un menor tiempo y con menor riesgo asociado, debido a las gestiones,\ncontroles y planificaciones realizadas. participación en capex y seguimiento económico\nde proyectos de corto plazo.\nabril a julio 2016\npráctica profesional realizada en cicitem, investigando y evaluando un proceso de\nevaporación de soluciones pls. liderando al equipo de trabajo, planificando y organizando\npruebas de laboratorio, logrando obtener sulfato de cobre pentahidratado de alta pureza.\nenero a marzo 2011 y septiembre a noviembre 2011\nanalista químico en laboratorio sgs verilab. realizando análisis químico de muestras de\ntronadura, pilas y ripios. además de reemplazar frecuentemente al supervisor, logrando\nexperiencia de trabajo en equipo, seguridad laboral y manejo de conflictos.\nenero 2009 a febrero 2010\nmuestrero de pozos de tronadura en empresa guiñez ing. faena spence, y minera\nesperanza. como primer trabajo logre experiencia de faena específicamente en rajo\nabierto, además de prácticas en seguridad como en relaciones personales.\nhabilidades técnicas\nidioma\ninglés, nivel intermedio en traducción, escrito y hablado.\ninformática nivel intermedio - avanzado de software mineros y gráficos autocad,\nvulcan, sgems y ventsim.\nnivel avanzado de office word, excel, power point y project.\nnivel medio en software primavera.\ncursos y/o capacitaciones\naño 2008\nlicencia de conducir clase b\naño 2015\ndiplomado en medio ambiente dictado en el centro regional de estudios y educación\nambiental crea de la universidad de antofagasta.\n2018\ncurso de trabajo en altura para supervisores collahuasi.\n",
    "Resumen": "angelo alfonso astorga rozas\ningeniero civil en minas, universidad de antofagasta\ne- mail astorga.rozas@gmail.com teléfono 09 92146683 antofagasta, chile\nobjetivos personales\ndesempeñarme en una empresa de experiencia, la cual pueda contribuir en mi\nformación como profesional. me considero una persona dinámica, que sabe trabajar en\nequipo, preocupándome siempre de mi seguridad y la de mis compañeros. tengo ganas de\nser un aporte, aplicando lo que he aprendido a través del transcurso de mi carrera, también\nme interesa seguir ampliando mis conocimientos para seguir creciendo como persona y\ncomo profesional.\n",
    "Referencias": "referencias\n\nmarcelo montenegro concha, doctor en procesamiento de minerales, cicitem.\nteléfono\n0962261252\ne-mail\nmontenegroconcha@gmail.com\nvictor sandoval navarro, ingeniero comercial e ingeniero en prevención de\nriesgos, todo acero.\nteléfono\n0993160386\ne-mail\nvsandoval@todoacero.cl\n\nmauricio zurita salvo, ingeniero industrial senior de calidad, hatch.\nteléfono\n0999988230\ne-mail\nmauricio.zurita@hatch.com\n",
    "Skills": [
        "Word",
        "Vulcan",
        "Autocad",
        "Excel",
        "Office",
        "Ventsim",
        "Power point"
    ]
}