{
    "Contacto": {
        "Nombre": "Personales Nombre Mar ",
        "Correo": [
            "mariogutierrezm@gmail.com"
        ],
        "Celular": "+56988240609",
        "Linkedin": null
    },
    "Nombre archivo": "1567523955310-Mario_Guti�rrez_-_CV_2019",
    "Licencias-Certificaciones": [],
    "Palabras Claves": [
        "Análisis",
        "Adaptable"
    ],
    "Educacion": {
        "Universidades:": [
            "Universidad Técnica Federico Santa María"
        ],
        "Grado_mas_alto": [
            "Ingeniería"
        ]
    },
    "Lenguajes": [
        "Inglés"
    ],
    "Experiencia": "",
    "Resumen": "1. datos personales nombre mario alejandro gutiérrez morales. fecha de nacimiento 25 de septiembre de 1996. edad 22 años. nacionalidad chilena. rut 19.450.451-9 dirección san luis nº 465, cerro placeres, valparaíso. teléfono 56 988240609 correo electrónico mariogutierrezm@gmail.com 2. perfil como estudiante de ingeniería civil y de formación generalista, busco ampliar y mejorar mis conocimientos en el área estructural mediante la experiencia que brinda la práctica profesional. actualmente curso el 10 semestre de la carrera, sin materias reprobadas, adquiriendo un amplio conocimiento, especialmente en los ramos de análisis estructural, dinámica de estructuras y hormigón armado i y ii. 3. formación académica enseñanza superior - grado en ingeniería civil 2015 actualidad universidad técnica federico santa maría, valparaíso. - licenciatura en ciencias de la ingeniería civil 2015 2018 universidad técnica federico santa maría, valparaíso. enseñanza media y básica - liceo católico atacama, copiapó 2003 2014. 4. experiencia laboral - cargo dibujante en autocad, desde 02/01/18 hasta 02/02/18. empresa empresa nacional de minería enami. práctica profesional i. traspaso de planos físicos a digital, revisión y actualización de planos, levantamiento de piezas e inspección y medición de elementos estructurales en terreno. 5. manejo computacional - autocad nivel medio - etabs nivel medio - sap2000 nivel medio - matlab nivel medio - microsoft office nivel avanzado 6. competencias profesionales - capacidad de análisis, resolución de problemas y toma de decisiones. - aprendizaje rápido y buena capacidad para adaptarse a los cambios. - dedicación y constancia para obtener los resultados deseados. - excelente manejo computacional. - capacidad de innovación. - habilidades organizativas. - nivel de inglés medio. 7. distinciones académicas - premio a la excelencia para primer año usm 2015. - finalista del ciclo nacional de ensayos psu usm 2014. - ",
    "Referencias": "",
    "Skills": [
        "Office",
        "Autocad",
        "Matlab"
    ]
}