{
    "Contacto": {
        "Nombre": null,
        "Correo": [
            "camilacordova02@gmail.com"
        ],
        "Celular": "+56952519971",
        "Linkedin": null
    },
    "Nombre archivo": "1568341836886-CV__Camila_Cordova__2019_PJP",
    "Licencias-Certificaciones": [
        "LICENCIA DE CONDUCIR",
        "CLASE B"
    ],
    "Palabras Claves": [
        "Voluntariado",
        "Modelamiento"
    ],
    "Educacion": {
        "Universidades:": [
            "Universidad de Concepción",
            "Universidad Católica del Norte",
            "Universidad de Antofagasta"
        ],
        "Grado_mas_alto": [
            "Ingeniería"
        ]
    },
    "Lenguajes": [],
    "Experiencia": "",
    "Resumen": "i - información personal\ningeniero civil metalúrgico\nuniversidad de concepción\nnombre\ncamila ignacia córdova vega\nrut\n17.732.277-6\nfecha de nacimiento\n25/06/1991\nedad\n28 años\nnacionalidad\nchilena\nii información de contacto\nemail\ncamilacordova02@gmail.com\nnúmero de contacto\n56-9-52519971\nresidencia\ndubley almeyda 3755, ñuñoa, santiago de chile.\niii - información académica\n\nenseñanza superior e.s.\ninstitución\nuniversidad de concepción\ncarrera\ningeniería civil metalúrgica\ngrado académico\nprofesional- titulada.\naño de ingreso\naño de titulación\n2010\n2015\nseminario de titulación\ndeterminación de la tasa de riego en pilas de\nlixiviación para minerales de cobre. aprobada con\ndistinción máxima\nranking de egreso\n1 lugar de la generación.\nnota final de pregrado\n5.8 escala 1-7\ndetalles enseñanza superior\nayudantías realizadas en departamento de ingeniería civil metalúrgica de la universidad de\nconcepción.\nhidrometalurgia\ncinética de procesos metalúrgicos\nfenómenos de transporte\nbalance de materia y energía\nconcentración gravimetrica y magnética\nbecas obtenidas por desempeño académico\nbeca bicentenario y beca alimentación\n2010- 2015\nbeca presidente de la republica\n2006-2015\niii experiencia laboral\n2018 mayo- actualidad\ningeniero estadístico geometalúrgico- guiñez ingeniería-planta piloto en compañía minera\ncerro colorado, bhp, iquique. recopilación, ordenamiento y reporte de resultados en\npruebas geo metalúrgicas, creación de informes directos a superintendencia cmcc bhp.\ncreación de balances metalúrgicos de extracción por solventes, pruebas de columnas de\nlixiviación, sulfataciones, gaviones, lixiviación en botellas.\n2017 junio- mayo 2018\ningeniero de procesos- sgs minerals - hidrometalurgia., antofagasta\nproyectos trabajados lixiviación en columnas- lixiviación en botellas- pruebas de\nconductividad hidráulica- sulfatación de correas y preparación granulométrica. reemplazos\nen supervisor de turno en proyecto calcopirita en minera escondida lmtda bhp\ndurante febrero/marzo 2018.\niv - proyectos de investigación\nárea minera\n2014-2015 proyectos de estudio de conductividad hidráulica en pilas de lixiviación. codelco,\nangloamerican.\n2016 evaluación preliminar de un modelo cinético hidro-geomecanico. universidad de\nantofagasta.\n2016 lixiviación de sulfuros primarios de cobre en medio cloruro ferroso. universidad de\nantofagasta\nv conocimientos informáticos\n\nmicrosoft office word, excel, power point nivel profesional\n\nautocad software para dibujar planos en cualquier área de la ingeniería y realizar dibujos en 3d.\nnivel avanzado\n\nmatlab software para resolver problemas con elevados cálculos matemáticos y visualización\ngrafica de los mismos. nivel avanzado\n\nvisual basic editor de excel para realizar macros y programación. nivel avanzado\n\nmoly-cop-tolls herramienta que evalúa la potencia de molinos sag. nivel avanzado\n\nsimpesp software que permite diseñar y simular un espesador convencional del tipo utilizado en\nla industria minera. nivel avanzado\n\ngmpx-pro software para realizar los controles de ensayos no destructivos. nivel avanzado\nvi- seminarios\n\n2018 69 convención anual del instituto de ingenieros de minas de chile, iimch, diciembre,\nantofagasta.\n\n2017 68 convención anual del instituto de ingenieros de minas de chile, imch, noviembre, iquique.\n\n2017 xx seminario técnico solvay 12, 13 octubre. hotel antofagasta\n\n2016 workshop water and energy in the chilean mining sector chile/uk research. universidad\ncatólica del norte, antofagasta\n\n2015 66ª convención del instituto de ingenieros de minas de chile, iimch, calama.\nii - información sobre actividades sociales y deportivas\n\n2015- actualidad socio activo en instituto de ingenieros de minas de chile- núcleo norte.\n\n2014-actualidad participante activa en programas de acondicionamiento físico.\n\n2014-2015 voluntaria en organizar eventos tipo extra programáticos en centro de alumnos de\ningeniería civil metalúrgica.\nviii- información adicional\n\nlicencia de conducir si- clase b\n\ndisponibilidad inmediata\n\n",
    "Referencias": "",
    "Skills": [
        "Power point",
        "Matlab",
        "Visual basic",
        "Autocad",
        "Excel",
        "Word",
        "Office",
        "Macros"
    ]
}