{
    "Contacto": {
        "Nombre": "Javiera Andrea Fuenzalida ",
        "Correo": [
            "j.fuenzalida@hotmail.com"
        ],
        "Celular": "+56976670204",
        "Linkedin": null
    },
    "Nombre archivo": "1568402627467-Curriculum_Vitae_Javiera_Fuenzalida",
    "Licencias-Certificaciones": [],
    "Palabras Claves": [
        "Analizar",
        "Aprender",
        "Estrategia",
        "Gestión",
        "Responsabilidad",
        "Puntual"
    ],
    "Educacion": {
        "Universidades:": [
            "Universidad de Tarapacá"
        ],
        "Grado_mas_alto": [
            "Ingeniería"
        ]
    },
    "Lenguajes": [
        "Inglés"
    ],
    "Experiencia": "experiencia laboral 2017 2018. ayudantias en la universidad de tarapacá. funciones realizar ayudantía en las asignaturas de sistema de información administrativa y taller de integración de conocimientos, a alumnos de cuarto año de la carrera de ingeniería civil industrial, además de introducción a la física, a alumnos de primer año de la carrera de ingeniería civil industrial. 2018. komatsu reman center. funciones control de ingreso de trabajos realizados por proveedores externos y pago a proveedores. las tareas realizadas se dividen en tres actividades importantes la primera es el ingreso de datos en el programa sap, donde se registraba el trabajo realizado por los proveedores externos fecha de inicio, costo, fecha de término y el componente a reparar. la segunda, la creación y actualización de la planilla excel, donde se mantendrá informática uso nivel avanzado de microsoft office excel, word y power point. uso nivel intermedio de microsoft office access software wordpress, spss y simio. actualizada la fecha de inicio de los trabajos y de esta forma la empresa analizar el desempeño de cada proveedor externo. y el último, el ingreso de las facturas para poder realizar los pagos a cada proveedor. 2019 compañía minera zaldivar. funciones gestión de indicadores de desempeño, actualización de estrategias en sap y seguimientos de puesta en marcha del sistema rmes. en el sistema sap se implementó la estrategia de mantenimiento pautas y procedimientos de trabajos específicos para las hojas de rutas existentes para los activos de operaciones minas, además de la obtención de los indicadores kpi de los trabajos realizados semanalmente en la compañía, por medio del programa sap y excel. por último, el seguimiento de la implementación del nuevo sistema utilizado en la compañía el sistema rmes para mantenimiento minas. javiera andrea fuenzalida verdejo. estudiante ingeniería civil industrial, uta. ",
    "Resumen": null,
    "Referencias": "",
    "Skills": [
        "Word",
        "Office",
        "Power point",
        "Wordpress",
        "Excel",
        "Sap",
        "Access"
    ]
}