{
    "Contacto": {
        "Nombre": null,
        "Correo": "on.habid@hotmail.es",
        "Celular": "+56941038636",
        "Linkedin": null
    },
    "Nombre archivo": "1568597041916-CV_HROJAS2019",
    "Licencias-Certificaciones": [
        "CLASE B"
    ],
    "Palabras Claves": [
        "Puntual",
        "Compromiso",
        "Proactividad",
        "Disposición",
        "Modelamiento",
        "Voluntariado",
        "Responsabilidad"
    ],
    "Educacion": {
        "Universidades:": [
            "Instituto Profesional INACAP",
            "Universidad de Aconcagua"
        ],
        "Grado_mas_alto": [
            "Ingeniería"
        ]
    },
    "Lenguajes": [
        "Español",
        "Inglés intermedio",
        "Inglés"
    ],
    "Experiencia": "experiencia laboral\nperfil personal\ncon respecto a mis cualidades personales, puedo destacar mi\nresponsabilidad, proactividad, mi capacidad de trabajar en equipos\ngrandes y pequeños y también mis buenas relaciones personales y\nbuen trato. además de mi puntualidad y compromiso con los\ntrabajos que se me asignen. para ellos poseo un rápido\nentendimiento y siempre una buena disposición para lograr los\nobjetivos deseados. con respecto a mis conocimientos, poseo un\nnivel de inglés intermedio y computación intermedio-avanzado\nsegún el tipo de software, además de una sólida formación\nacadémica en el área de minería actual.\n2015 - 2018 ingeniería en minas titulado\nsantiago - chile instituto profesional inacap\n2011 - 2013 técnico en minas egresado\nlos andes - chile universidad de aconcagua\n2007 - 2010 enseñanza media\nlos andes - chile liceo maximiliano salas marchant\ncajero - cencosud easy retail mayo 2017- actualidad\npráctica profesional codelco división andina enero 2017- marzo\n2017\nadministrativo - ram construcciones junio 2016 octubre 2016\nayudante obras civiles enero 2016 abril 2016\nvoluntariado\nparticipación en mi última casa de estudios, en actividad de ayuda\npara los nuevos estudiantes que ingresaban a la carrera de minería\nejerciendo la labor de alumno padrino, donde se le brindaba apoyo\nde todo tipo a las nuevas generaciones con una duración\naproximada de 1 año.\nsoftware\noffice\nexcel\npowerpoint\nword\nproyect\ntronadura\njk simblast 2dface\n2dbench 2dring\ngeomecánica\ndips\nrocplane\nswedge\nunwedge\nslide\nmodelamiento minero\ndatamine rmstudio\ndiseño\n5d planner dt\nopet pit dt\nventilación\nventsim\nautocad\ni-site\nlicencias\nlicencia clase b vigente, con más de 8 años de experiencia.\nlicencia de programador calculista y manipulador de explosivos\nvigente, validada por la autoridad dgmn por un periodo de 3 años\n",
    "Resumen": "resumen\ningeniero en minas\nespañol lengua materna\ninglés intermedio\n",
    "Referencias": "",
    "Skills": [
        "Word",
        "Autocad",
        "Powerpoint",
        "Excel",
        "Office",
        "Ventsim"
    ]
}