{
    "CONTACTO": {
        "NOMBRE": "Pic María Alejandra ",
        "CORREO": [
            "ale.pca@gmail.com"
        ],
        "CELULAR": "+56981562661",
        "LINKEDIN": null
    },
    "NOMBRE_ARCHIVO": "1570738955125-Ma._Alejandra_Carrasco_Guamán_resume.doc",
    "LICENCIA_CERTIFICACION": [],
    "PALABRAS_CLAVES": null,
    "EDUCACION": {
        "UNIVERSIDADES:": [
            "UNIVERSIDAD DE CHILE"
        ],
        "GRADO_MAS_ALTO": []
    },
    "IDIOMAS": [
        "ENGLISH"
    ],
    "EXPERIENCIA": "in Pharmaceutical Regulatory Affairs. August 2019 to present Roche Chile Ltda. Job rotation at Quality Assurance qa department as Qa specialist September 2018 August 2019 Roche Chile Ltda. Regulatory affairs managers assistant Assuring compliance with the regulatory framework for the import and distribution of pharmaceutical products, cosmetics and medical devices, considering the sanitary registry and its updates, imports, quality control, reconditioning, distribution and quality management system. Pharmacovigilance surrogate officer Compiling, supply documentation evidence and evaluating the reports on quality complaints, adverse reactions and adverse events coordinating the required measures. February 2017 March 2018 Laboratorios Saval S. A. Regulatory affairs advisor product registration Responsible for post approval changes of medicinal products with marketing authorization in Latin and South American subsidiaries to which Laboratorios Saval exports its products digemid Peru Arcsa Ecuador Farmacia y Drogas Panama Unimed Bolivia Ministry of Health and Welfare Paraguay Ministry of Public Health Uruguay, among others. Management of information and activities related to regulatory requirements to perform such changes creation and maintenance of relevant documentation system and, finally, assuring compliance of applicable health regulations in each country. Responsible for the harmonization of the companys products packaging and promotional materials, in compliance with current regulations in Chile and associated countries. Support in regulatory activities within the area of National Registration, Laboratorios Saval. August 2016 January 2017 Labortorios Saval S. A. Internship to apply for a Pharmacist degree The internship was carried out for a six-month period at the Regulatory Affairs Department of the National Registration at Laboratorios Saval S.a. application of Chilean legal framework for regulatory activities within the approval changes of medicinal products, renewals, development of physical documentation systems, as well as teamwork activities. Education consistently effective and professional manner. Excellent attention-to- environment and independently. Thank you for taking time to read my resume. I am looking forward to perhaps interviewing with your company. María Alejandra ",
    "RESUMEN": "pic maría alejandra carrasco guamán e-mail ale.pca@gmail.com cell phone 569 81562661 santiago, chile pharmacist at universidad de chile, with more than one year of experience in pharmaceutical regulatory affairs. employment history august 2019 to present roche chile ltda. job rotation at quality assurance qa department as qa specialist september 2018 august 2019 roche chile ltda. drug regulatory affairs associate april 2018 september 2018 laboratorios raffo s. a. regulatory affairs managers assistant assuring compliance with the regulatory framework for the import and distribution of pharmaceutical products, cosmetics and medical devices, considering the sanitary registry and its updates, imports, quality control, reconditioning, distribution and quality management system. pharmacovigilance surrogate officer compiling, supply documentation evidence and evaluating the reports on quality complaints, adverse reactions and adverse events coordinating the required measures. february 2017 march 2018 laboratorios saval s. a. regulatory affairs advisor product registration responsible for post approval changes of medicinal products with marketing authorization in latin and south american subsidiaries to which laboratorios saval exports its products digemid peru arcsa ecuador farmacia y drogas panama unimed bolivia ministry of health and welfare paraguay ministry of public health uruguay, among others. management of information and activities related to regulatory requirements to perform such changes creation and maintenance of relevant documentation system and, finally, assuring compliance of applicable health regulations in each country. responsible for the harmonization of the companys products packaging and promotional materials, in compliance with current regulations in chile and associated countries. support in regulatory activities within the area of national registration, laboratorios saval. august 2016 january 2017 labortorios saval s. a. internship to apply for a pharmacist degree the internship was carried out for a six-month period at the regulatory affairs department of the national registration at laboratorios saval s.a. activities performed and expertise gained included knowledge and application of chilean legal framework for regulatory activities within the pharmaceutical industry knowledge and use of different features of the gicona online platform development and submission of dossiers, post approval changes of medicinal products, renewals, development of educational materials maintenance of both digital sap software and physical documentation systems, as well as teamwork activities. education 2011 - 2017 universidad de chile - santiago pharmacy degree miscellaneous application of computational tools sap erp software, gicona online information system of the instituto de salud pública, chile, windows, office word, excel, powerpoint. english intermediate level. currently upgrading language skills at one-on- one classes. abilities and skills knowledge of ich and who guidelines. good verbal and written communication skills can be relied upon to communicate in a consistently effective and professional manner. excellent attention-to- detail, and, finally, ability to work effectively both within a team environment and independently. thank you for taking time to read my resume. i am looking forward to perhaps interviewing with your company. ",
    "SKILLS": [
        "WORD",
        "SAP",
        "OFFICE",
        "EXCEL",
        "ERP",
        "WINDOWS"
    ],
    "REFERENCIAS": ""
}