{
    "Contacto": {
        "Nombre": "Andrés Wilfredo Ló ",
        "Correo": "Andres7391@hotmail.com",
        "Celular": "+56957116531",
        "Linkedin": null
    },
    "Nombre archivo": "1571450416563-CV_Andres_Lopez_Salas",
    "Licencias-Certificaciones": [
        "CLASE B"
    ],
    "Palabras Claves": [
        "Gestión",
        "Responsabilidad",
        "Proactividad"
    ],
    "Educacion": {
        "Universidades:": [
            "Universidad de Antofagasta"
        ],
        "Grado_mas_alto": [
            "Ingeniería"
        ]
    },
    "Lenguajes": [
        "Inglés"
    ],
    "Experiencia": "",
    "Resumen": "curriculum vitae andrés wilfredo lópez salas dirección cerro bayo 01774, coviefi. antofagasta teléfono 56 957116531 e-mail andres7391@hotmail.com 1.- resumen titulado en la carrera de ingeniería civil industrial en la universidad de antofagasta. alumno con beca por excelencia académica otorgada por minera escondida desde el primer año de carrera. persona responsable, proactiva, con rapidez de aprendizaje y capaz de aceptar nuevos desafíos. trabajo de titulación basado en la creación de un sistema de gestión de apoyo a emprendedores de pymes manufactureras de la ciudad, en la creación, expansión y mejora de sus empresas. 2.- formación académica enseñanza básica escuela f-96 libertadores de chile, antofagasta enseñanza media hrvatska skola san esteban, antofagasta enseñanza superior titulado de ingeniería civil industrial en universidad de antofagasta, antofagasta. 3.- conocimientos informática nivel usuario avanzado de microsoft office excel, word, power point, otros. conocimiento en 1sap y access. ",
    "Referencias": "",
    "Skills": [
        "Power point",
        "Word",
        "Access",
        "Excel",
        "Office"
    ]
}